{
  "exercise_id": "dumbbell_lateral_raise",
  "exercise_name": "Dumbbell Lateral Raise",
  "variation": "standing bilateral",
  "movement_pattern": "isolation_raise",
  "muscles": {
    "primary": ["deltoids"],
    "secondary": ["trapezius", "forearm_flexors"]
  },
  "setup": {
    "body_position": "standing",
    "stance": "hip_width",
    "grip": "neutral",
    "bench_angle": null
  },
  "equipment": [
    {"type": "dumbbell", "count": 2, "handheld": true}
  ],
  "laterality": "bilateral",
  "timing": {"fps": 12, "duration_sec": 3.0, "loop": true},
  "phases": [
    {"name": "bottom_pause", "start_t": 0.0, "end_t": 0.25, "tempo_hint": "pause"},
    {"name": "concentric", "start_t": 0.25, "end_t": 1.3, "tempo_hint": "controlled_up"},
    {"name": "top_pause", "start_t": 1.3, "end_t": 1.6, "tempo_hint": "brief_hold"},
    {"name": "eccentric", "start_t": 1.6, "end_t": 2.8, "tempo_hint": "controlled_down"},
    {"name": "reset", "start_t": 2.8, "end_t": 3.0, "tempo_hint": "settle"}
  ],
  "joint_targets": [
    {
      "joint": "left_shoulder",
      "track": [
        {"t": 0.0, "flexion_deg": 10, "abduction_deg": 8, "rotation_deg": 0},
        {"t": 1.3, "flexion_deg": 20, "abduction_deg": 85, "rotation_deg": 5},
        {"t": 3.0, "flexion_deg": 10, "abduction_deg": 8, "rotation_deg": 0}
      ]
    },
    {
      "joint": "right_shoulder",
      "track": [
        {"t": 0.0, "flexion_deg": 10, "abduction_deg": 8, "rotation_deg": 0},
        {"t": 1.3, "flexion_deg": 20, "abduction_deg": 85, "rotation_deg": -5},
        {"t": 3.0, "flexion_deg": 10, "abduction_deg": 8, "rotation_deg": 0}
      ]
    },
    {
      "joint": "left_elbow",
      "track": [
        {"t": 0.0, "flexion_deg": 15, "abduction_deg": null, "rotation_deg": null},
        {"t": 1.3, "flexion_deg": 20, "abduction_deg": null, "rotation_deg": null},
        {"t": 3.0, "flexion_deg": 15, "abduction_deg": null, "rotation_deg": null}
      ]
    },
    {
      "joint": "right_elbow",
      "track": [
        {"t": 0.0, "flexion_deg": 15, "abduction_deg": null, "rotation_deg": null},
        {"t": 1.3, "flexion_deg": 20, "abduction_deg": null, "rotation_deg": null},
        {"t": 3.0, "flexion_deg": 15, "abduction_deg": null, "rotation_deg": null}
      ]
    }
  ],
  "equipment_path": [
    {
      "object": "left_dumbbell",
      "track": [
        {"t": 0.0, "x": -0.22, "y": 0.0, "z": 0.76},
        {"t": 1.3, "x": -0.65, "y": 0.02, "z": 1.28},
        {"t": 3.0, "x": -0.22, "y": 0.0, "z": 0.76}
      ]
    },
    {
      "object": "right_dumbbell",
      "track": [
        {"t": 0.0, "x": 0.22, "y": 0.0, "z": 0.76},
        {"t": 1.3, "x": 0.65, "y": 0.02, "z": 1.28},
        {"t": 3.0, "x": 0.22, "y": 0.0, "z": 0.76}
      ]
    }
  ],
  "contacts": [
    {"body_part": "left_hand", "target": "left_dumbbell", "mode": "grasp"},
    {"body_part": "right_hand", "target": "right_dumbbell", "mode": "grasp"},
    {"body_part": "left_foot", "target": "floor", "mode": "support"},
    {"body_part": "right_foot", "target": "floor", "mode": "support"}
  ],
  "notes": [
    "raise in scapular plane",
    "slight elbow bend maintained",
    "avoid shrugging"
  ],
  "confidence": {
    "exercise_label": 0.95,
    "joint_targets": 0.8,
    "equipment_path": 0.72
  }
}
